{
  "format": "open-blast-benchmark-results",
  "format_version": 1,
  "code": {
    "name": "pyro2",
    "version": "4.5.1",
    "url": "https://github.com/python-hydro/pyro2"
  },
  "prepared": "2026-10-21",
  "notes": [
    "pyro2 4.5.1 (PyPI pyro-hydro, BSD-3-Clause), unchanged, on the ideal-gas-balloon-v1 decks through Benchmarks/open/other-codes/pyro2/run_deck.py: the decks' gas, ambient state, balloon (excess mass and energy on ambient), stop times, sampling and read rules, imported and extracted by Scripts/open-benchmark/run_decks.py.",
    "One stated deviation: 1-D spherical on pyro2's spherical-polar grid, not the decks' 3-D mesh. The free field is the whole 200 kg sphere on 20 mm cells to 36 m (outflow); the room a closed sphere of the cube's 216 m^3 on 20 mm cells, its volume-weighted mean pressure. Every solver step is a sample (largest 15 us).",
    "Numba's JIT was off (the venv has no SciPy), so the runs are slow, not different: the free field took two hours.",
    "Record: Benchmarks/open/records/pyro2-ideal-gas-balloon-v1/. Histories on StudioData; their hashes are in its receipt."
  ],
  "cases": [
    {
      "case": "kb-surface-burst-free-field",
      "configuration": "ideal-gas-balloon-v1",
      "predictions": [
        {
          "run": "100kg",
          "gauge": "Z0.75",
          "quantity": "peak_incident_overpressure",
          "unit": "kPa",
          "value": 2832.0217312410937
        },
        {
          "run": "100kg",
          "gauge": "Z0.75",
          "quantity": "incident_positive_impulse",
          "unit": "kPa*ms",
          "value": 829.5028009051367
        },
        {
          "run": "100kg",
          "gauge": "Z0.75",
          "quantity": "arrival_time",
          "unit": "ms",
          "value": 1.271438724015252
        },
        {
          "run": "100kg",
          "gauge": "Z1",
          "quantity": "peak_incident_overpressure",
          "unit": "kPa",
          "value": 1601.0526332842765
        },
        {
          "run": "100kg",
          "gauge": "Z1",
          "quantity": "incident_positive_impulse",
          "unit": "kPa*ms",
          "value": 867.3832119060271
        },
        {
          "run": "100kg",
          "gauge": "Z1",
          "quantity": "arrival_time",
          "unit": "ms",
          "value": 2.017663614314714
        },
        {
          "run": "100kg",
          "gauge": "Z1.5",
          "quantity": "peak_incident_overpressure",
          "unit": "kPa",
          "value": 588.584150778659
        },
        {
          "run": "100kg",
          "gauge": "Z1.5",
          "quantity": "incident_positive_impulse",
          "unit": "kPa*ms",
          "value": 611.7142796626714
        },
        {
          "run": "100kg",
          "gauge": "Z1.5",
          "quantity": "arrival_time",
          "unit": "ms",
          "value": 4.217798623269589
        },
        {
          "run": "100kg",
          "gauge": "Z2",
          "quantity": "peak_incident_overpressure",
          "unit": "kPa",
          "value": 285.6490596003146
        },
        {
          "run": "100kg",
          "gauge": "Z2",
          "quantity": "incident_positive_impulse",
          "unit": "kPa*ms",
          "value": 492.9525210364226
        },
        {
          "run": "100kg",
          "gauge": "Z2",
          "quantity": "arrival_time",
          "unit": "ms",
          "value": 7.395847729058676
        },
        {
          "run": "100kg",
          "gauge": "Z3",
          "quantity": "peak_incident_overpressure",
          "unit": "kPa",
          "value": 113.80424500503406
        },
        {
          "run": "100kg",
          "gauge": "Z3",
          "quantity": "incident_positive_impulse",
          "unit": "kPa*ms",
          "value": 369.86266777567715
        },
        {
          "run": "100kg",
          "gauge": "Z3",
          "quantity": "arrival_time",
          "unit": "ms",
          "value": 15.969289735545237
        },
        {
          "run": "100kg",
          "gauge": "Z4",
          "quantity": "peak_incident_overpressure",
          "unit": "kPa",
          "value": 64.44156690846937
        },
        {
          "run": "100kg",
          "gauge": "Z4",
          "quantity": "incident_positive_impulse",
          "unit": "kPa*ms",
          "value": 291.2638274248974
        },
        {
          "run": "100kg",
          "gauge": "Z4",
          "quantity": "arrival_time",
          "unit": "ms",
          "value": 26.313132467300225
        },
        {
          "run": "100kg",
          "gauge": "Z5",
          "quantity": "peak_incident_overpressure",
          "unit": "kPa",
          "value": 43.28399837951112
        },
        {
          "run": "100kg",
          "gauge": "Z5",
          "quantity": "incident_positive_impulse",
          "unit": "kPa*ms",
          "value": 238.06198565236397
        },
        {
          "run": "100kg",
          "gauge": "Z5",
          "quantity": "arrival_time",
          "unit": "ms",
          "value": 37.61670158776634
        },
        {
          "run": "100kg",
          "gauge": "Z6",
          "quantity": "peak_incident_overpressure",
          "unit": "kPa",
          "value": 32.224159182840204
        },
        {
          "run": "100kg",
          "gauge": "Z6",
          "quantity": "incident_positive_impulse",
          "unit": "kPa*ms",
          "value": 200.52365868925443
        },
        {
          "run": "100kg",
          "gauge": "Z6",
          "quantity": "arrival_time",
          "unit": "ms",
          "value": 49.48644770424975
        }
      ],
      "notes": [
        "100kg: deck sha256 2884564266f1efed782bafbeddfb3bb130280c05764c28ba031fe130ce86ea87; history sha256 c1259d9740407318daea5bcc4d3195772f53ec53c37d6b05da17bf00a9fe1c49"
      ]
    },
    {
      "case": "ufc-closed-room-gas-pressure",
      "configuration": "ideal-gas-balloon-v1",
      "predictions": [
        {
          "run": "0.25kg-m3",
          "gauge": "room",
          "quantity": "quasi_static_gas_pressure",
          "unit": "kPa",
          "value": 416.9999126048713
        },
        {
          "run": "0.5kg-m3",
          "gauge": "room",
          "quantity": "quasi_static_gas_pressure",
          "unit": "kPa",
          "value": 837.0118353624388
        },
        {
          "run": "1kg-m3",
          "gauge": "room",
          "quantity": "quasi_static_gas_pressure",
          "unit": "kPa",
          "value": 1672.628215356419
        },
        {
          "run": "2kg-m3",
          "gauge": "room",
          "quantity": "quasi_static_gas_pressure",
          "unit": "kPa",
          "value": 3341.510097626036
        },
        {
          "run": "4kg-m3",
          "gauge": "room",
          "quantity": "quasi_static_gas_pressure",
          "unit": "kPa",
          "value": 6647.195691391387
        }
      ],
      "notes": [
        "0.25kg-m3: deck sha256 87fd28617d469e056434faeae156aa71ce41b1f2fc7b28d05d54b5843307b214; history sha256 5aed713b0df462bf2754ee7d68309479e5cfa57f9d022f5b5ef9999c3d337d25",
        "0.25kg-m3: fixed 100-120 ms room proxy; relative half-window drift 1.49427e-05; not an assertion of equilibrium",
        "0.5kg-m3: deck sha256 87fd28617d469e056434faeae156aa71ce41b1f2fc7b28d05d54b5843307b214; history sha256 8f9fa2971e2f185fca892c717e465b9d48dba8328df887dc63c1f458c3872352",
        "0.5kg-m3: fixed 100-120 ms room proxy; relative half-window drift -0.000117876; not an assertion of equilibrium",
        "1kg-m3: deck sha256 87fd28617d469e056434faeae156aa71ce41b1f2fc7b28d05d54b5843307b214; history sha256 dbd8bcdf65bb43b8bd921d0d9dd1d7c3c3ed7436e30d9847914317184d53bb70",
        "1kg-m3: fixed 100-120 ms room proxy; relative half-window drift 2.52256e-05; not an assertion of equilibrium",
        "2kg-m3: deck sha256 87fd28617d469e056434faeae156aa71ce41b1f2fc7b28d05d54b5843307b214; history sha256 8698b1849114c0d86582fd51f9e1b8d103f57fe69d1470cdc63a3c7b65cc99b5",
        "2kg-m3: fixed 100-120 ms room proxy; relative half-window drift -0.000304771; not an assertion of equilibrium",
        "4kg-m3: deck sha256 87fd28617d469e056434faeae156aa71ce41b1f2fc7b28d05d54b5843307b214; history sha256 bccd956cc604a3d3e086830d4ada302fc6aea358e563b78e9f15f28d96b77393",
        "4kg-m3: fixed 100-120 ms room proxy; relative half-window drift 2.48048e-05; not an assertion of equilibrium"
      ]
    }
  ]
}
